Title,Acronym,Source,Rank,Note,DBLP,Primary FoR,Comments,Average Rating
Information Retrieval Facility Conference,IRFC,CORE2018,Unranked,none,none,0806,0,N/A
International Conference on Advanced Communications and Computation,INFOCOMP,CORE2023,Unranked,none,none,46,0,N/A
"International Conference on Ambient Systems, Networks and Technologies",ANT,CORE2023,Unranked,none,https://dblp.uni-trier.de/db/conf/ant,4606,1,4.0
1st International Conference on Building Energy and Environment,COBEE,ERA2010,,none,none,1202,0,N/A
1st International Conference on Engineering Management,ICEM,ERA2010,,none,none,09,0,N/A
2008 International Conference on Biomedical Robotics and Biomechatronics,BIO ROB,ERA2010,B,none,none,0903,0,N/A
3-D Digital Imaging and Modelling,3DIM,CORE2018,C,none,none,0801,0,N/A
A Satellite workshop on Formal Approaches to Testing of Software,FATES,CORE2018,C,none,none,0802,0,N/A
AAAI Conference on Human Computation and Crowdsourcing,HCOMP,CORE2023,B,none,https://dblp.uni-trier.de/db/conf/hcomp,4608,0,N/A
AAEE - Annual Conference of Australasian Association for Engineering Education,,ERA2010,B,none,none,09,1,4.0
Accelerating excellence in the built environment World Conference,WCAEBE,ERA2010,C,none,none,1202,0,N/A
Accounting and Finance Association of Australia and New Zealand Conference,AFAANZ,CORE2018,Australasian,none,none,0806,0,N/A
"ACIS Conference on Software Engineering Research, Management and Applications",SERA,CORE2023,C,none,https://dblp.uni-trier.de/db/conf/sera,4612,1,4.0
ACM Annual Computer Science Conference,CSC,CORE2018,C,none,none,08,0,N/A
"ACM Conference on Applications, Technologies, Architectures, and Protocols for Computer Communication",SIGCOMM,CORE2023,A*,none,https://dblp.uni-trier.de/db/conf/sigcomm,4606,1,5.0
ACM Conference on Computer and Communications Security,CCS,CORE2023,A*,none,https://dblp.uni-trier.de/db/conf/ccs,4604,0,N/A
ACM Conference on Computer Supported Cooperative Work,CSCW,CORE2023,A,none,https://dblp.uni-trier.de/db/conf/cscw,4608,1,5.0
ACM Conference on Digital Libraries,JCDL,CORE2018,A*,none,https://dblp.uni-trier.de/db/conf/jcdl,0806,2,4.5
ACM Conference on Economics and Computation,EC,CORE2023,A*,none,https://dblp.uni-trier.de/db/conf/sigecom,4602,2,5.0
ACM Conference on Embedded Networked Sensor Systems,SENSYS,CORE2023,A*,none,https://dblp.uni-trier.de/db/conf/sensys,4606,0,N/A
ACM Conference on Embedded Software,EMSOFT,CORE2023,Journal published,none,https://dblp.uni-trier.de/db/conf/emsoft,4606,0,N/A
ACM Conference on Hypertext and Social Media,Hypertext,CORE2018,A,none,https://dblp.uni-trier.de/db/conf/ht,0805,0,N/A
ACM Conference on Object Oriented Programming Systems Languages and Applications,OOPSLA,CORE2023,A,none,https://dblp.uni-trier.de/db/conf/oopsla,4612,0,N/A
ACM Conference on Security and Privacy in Wireless and Mobile Networks,ACM_WiSec,CORE2023,B,none,https://dblp.org/db/conf/wisec/index.html,4604,0,N/A
ACM Creativity and Cognition,CC,ERA2010,A,none,none,1203,1,5.0
ACM Digital Rights Management Workshop,DRM,CORE2018,C,none,none,0803,0,N/A
ACM Information Technology Education,SIGITE,CORE2023,National: USA,none,https://dblp.uni-trier.de/db/conf/sigite,4608,1,N/A
ACM Int'l Symposium on Field Programmable Gate Arrays,FPGA,CORE2023,TBR,See note,https://dblp.uni-trier.de/db/conf/fpga/index.html,CSE,1,5.0
"ACM International Conference on Advances in Computer Entertainment (merged with DIMEA, Digital Interactive Media in Entertainment and Arts, in 2009)",ACE,CORE2023,C,See note,none,4607,0,N/A
ACM International Conference on Advances in Geographic Information Systems,SIGSPATIAL,CORE2023,A,none,https://dblp.uni-trier.de/db/conf/gis,4601,0,N/A
ACM International Conference on Emerging Networking Experiments and Technologies,CoNEXT,CORE2023,A,none,https://dblp.uni-trier.de/db/conf/conext,4606,1,5.0
ACM International Conference on Information and Knowledge Management,CIKM,CORE2023,A,none,https://dblp.uni-trier.de/db/conf/cikm,4605,0,N/A
ACM International Conference on Interactive Surfaces and Spaces (was International Workshop on Horizontal Interactive Human-Computer Systems: Tabletop),ISS,CORE2023,Journal Published,none,https://dblp.uni-trier.de/db/conf/tabletop,4608,1,4.0
ACM International Conference on Knowledge Discovery and Data Mining,KDD,CORE2023,A*,none,https://dblp.uni-trier.de/db/conf/kdd,4605,1,N/A
ACM International Conference on Mobile Computing and Networking,MOBICOM,CORE2023,A*,none,https://dblp.uni-trier.de/db/conf/mobicom,4606,0,N/A
ACM International Conference on Recommender Systems,RecSys,CORE2023,A,none,https://dblp.uni-trier.de/db/conf/recsys,4605,0,N/A
ACM International Conference on Research and Development in Information Retrieval,SIGIR,CORE2023,A*,none,https://dblp.uni-trier.de/db/conf/sigir,4605,0,N/A
ACM International Conference on Supercomputing,ICS,CORE2023,A,none,https://dblp.uni-trier.de/db/conf/ics,CSE,0,N/A
ACM International Conference on Systems for Energy-Efficient Built Environments,BuildSys,CORE2018,A,none,none,0805,0,N/A
"ACM International Conference on the Foundations of Software Engineering (was ESEC/FSE, changed 2024; duplicate previously listed as ESEC, removed from DB)",FSE,CORE2023,A*,none,https://dblp.org/db/conf/sigsoft,4612,6,5.0
ACM International Conference on Web Search and Data Mining,WSDM,CORE2023,A,See note,https://dblp.uni-trier.de/db/conf/wsdm,4605,0,N/A
ACM International Joint Conference on Pervasive and Ubiquitous Computing (PERVASIVE and UbiComp combined from 2013),UbiComp,CORE2023,journal published,none,https://dblp.uni-trier.de/db/conf/huc,4608,0,N/A
ACM International Symposium on Computer Architecture,ISCA,CORE2023,A*,none,https://dblp.uni-trier.de/db/conf/isca,CSE,0,N/A
ACM International Symposium on High Performance Distributed Computing,HPDC,CORE2023,A,none,https://dblp.uni-trier.de/db/conf/hpdc,4606,0,N/A
ACM International Wireless Communications and Mobile Computing Conference,IWCMC,CORE2023,B,none,https://dblp.uni-trier.de/db/conf/iwcmc,4606,1,N/A
ACM International Workshop On Multimedia Databases,MMDB,CORE2018,C,none,none,0804,0,N/A
ACM International Workshop on. Mobility Management and Wireless Access,MobiWac,ERA2010,B,none,none,1005,0,N/A
ACM Multimedia,ACMMM,CORE2023,A*,none,https://dblp.uni-trier.de/db/conf/mm,4603,3,5.0
ACM SIG International Conference on Computer Graphics and Interactive Techniques,SIGGRAPH,CORE2023,A*,none,https://dblp.uni-trier.de/db/conf/siggraph,4607,1,5.0
ACM SIGCHI_NZ Conference on Human-Computer Interaction,SIGCHI-NZ,CORE2018,Australasian,none,none,0806,0,N/A
ACM SIGCOMM Internet Measurement Conference,ACM IMC,ERA2010,A,none,none,1005,0,N/A
ACM SIGGRAPH/Eurographics Symposium on Computer Animation,SCA,CORE2023,B,none,https://dblp.uni-trier.de/db/conf/sca,4607,1,4.0
ACM SIGIR Workshop on XML and Information Retrieval,SIGIR/XML,CORE2018,C,none,none,0804,0,N/A
ACM SIGMIS Computers and People Research,ACM-SIGMIS CPR,CORE2018,B,none,https://dblp.uni-trier.de/db/conf/sigcpr,0806,0,N/A
"ACM SIGMOBILE International Conference on Mobile Systems, Applications and Services",Mobisys,CORE2023,A,none,https://dblp.uni-trier.de/db/conf/mobisys,4606,5,5.0
ACM SIGMOD-SIGACT-SIGART Conference on Principles of Database Systems,PODS,CORE2023,A*,none,https://dblp.uni-trier.de/db/conf/pods,4605,0,N/A
ACM SIGOPS European Workshops,SIGOPS-EW,ERA2010,C,none,none,0803,0,N/A
ACM SIGOPS Symposium on Operating Systems Principles,SOSP,CORE2023,A*,none,https://dblp.uni-trier.de/db/conf/sosp,4606,0,N/A
"ACM SIGPLAN Conference on Languages, Compilers and Tools for Embedded Systems",LCTES,CORE2023,B,none,https://dblp.uni-trier.de/db/conf/lctrts,4606,0,N/A
ACM SIGPLAN Workshop on Partial Evaluation and Program Manipulation,PEPM,CORE2023,C,none,https://dblp.uni-trier.de/db/conf/pepm,4612,0,N/A
ACM SIGPLAN Workshop on Types in Language Design and Implementation (was TIC),TLDI,CORE2018,C,none,none,0803,0,N/A
ACM SIGSIM Conference on Principles of Advanced Discrete Simulation (was Parallel and Distributed Simulation),PADS,CORE2023,B,none,https://dblp.uni-trier.de/db/conf/pads,4606,0,N/A
ACM SIGSOFT Workshop on Program Analysis for Software Tools and Engineering,PASTE,CORE2017,B,none,none,0803,0,N/A
ACM SIGUCCS Conference on User Services,SIGUCCS,CORE2023,National: USA,none,https://dblp.uni-trier.de/db/conf/siguccs,4601,0,N/A
ACM Special Interest Group on Computer Science Education Conference,SIGCSE,CORE2023,A,none,https://dblp.uni-trier.de/db/conf/sigcse,4608,0,N/A
ACM Special Interest Group on Management of Data Conference,SIGMOD,CORE2023,A*,none,https://dblp.uni-trier.de/db/conf/sigmod,4605,0,N/A
ACM Special Interest Group on Supporting Group Work (was SIGGRoup),Group,CORE2023,B,none,https://dblp.org/db/conf/group/index.html,4608,1,N/A
"ACM Symposium on Access Control Models and Technologies (previously ACM Workshop on Role-Based Access Control, RBAC, changed in 2000)",SACMAT,CORE2023,C,none,https://dblp.uni-trier.de/db/conf/sacmat,4604,1,4.0
ACM Symposium on Applied Computing,SAC,CORE2023,Multiconference,none,https://dblp.uni-trier.de/db/conf/sac,4601,0,N/A
ACM Symposium on Document Engineering,DocEng,CORE2023,B,none,https://dblp.uni-trier.de/db/conf/doceng,4605,0,N/A
ACM Symposium on Mobile Ad Hoc Networking and Computing,MOBIHOC,CORE2023,A,none,https://dblp.uni-trier.de/db/conf/mobihoc,4606,0,N/A
ACM Symposium on Principles of Database Systems,SPDS,CORE2018,C,none,none,0804,0,N/A
ACM Symposium on Principles of Distributed Computing,PODC,CORE2023,A*,none,https://dblp.uni-trier.de/db/conf/podc,4606,0,N/A
ACM Symposium on Software Reusability,SSR,CORE2018,A,none,https://dblp.uni-trier.de/db/conf/ssr,0803,0,N/A
ACM Symposium on Solid and Physical Modelling,SPM,CORE2023,C,See note,none,4607,0,N/A
ACM Symposium on Theory of Computing,STOC,CORE2023,A*,none,https://dblp.uni-trier.de/db/conf/stoc,4613,1,5.0
ACM Symposium on User Interface Software and Technology,UIST,CORE2023,A*,none,https://dblp.uni-trier.de/db/conf/uist,4608,1,5.0
ACM Virtual Reality Software and Technology,VRST,CORE2023,A,none,https://dblp.uni-trier.de/db/conf/vrst,4607,0,N/A
ACM Workshop on Formal Methods in Security Engineering: From Specifications to Code,FMSE,CORE2018,C,none,none,0803,0,N/A
ACM Workshop on Hot Topics in Networks,HOTNETS,CORE2023,National: USA,none,https://dblp.uni-trier.de/db/conf/hotnets,4606,0,N/A
ACM Workshop on Hot Topics in Software Upgrades,HotSWUp,CORE2018,C,none,none,0803,0,N/A
ACM Workshop on Role Based Access Control (now SACMAT),RBAC,CORE2014,C,none,none,0802,0,N/A
ACM Workshop on Scalable Trusted Computing,STC,CORE2018,B,none,none,0803,0,N/A
ACM Workshop on Secure Web Services,SWS,CORE2018,C,none,none,0801,0,N/A
ACM Workshop on Web Information and Data Management,WIDM,CORE2018,B,none,none,0806,0,N/A
ACM-SIGACT Symposium on Principles of Programming Languages,POPL,CORE2023,A*,none,https://dblp.uni-trier.de/db/conf/popl,4612,0,N/A
ACM-SIGPLAN Conference on Programming Language Design and Implementation,PLDI,CORE2023,A*,none,https://dblp.uni-trier.de/db/conf/pldi,4612,0,N/A
ACM-SIGRAPH Interactive 3D Graphics and Games,I3DG,CORE2023,B,none,https://dblp.uni-trier.de/db/conf/si3d,4607,0,N/A
ACM/IEEE International Conference on Distributed Smart Cameras,ICDSC,CORE2021,B,none,https://dblp.uni-trier.de/db/conf/icdsc,4606,0,N/A
ACM/IEEE International Conference on Human-Robot Interaction,HRI,CORE2023,A,none,https://dblp.org/db/conf/hri/index.html,4608,0,N/A
"ACM/IEEE International Conference on Modelling, Analysis and Simulation of Wireless and Mobile Systems",MSWIM,CORE2023,A,none,https://dblp.uni-trier.de/db/conf/mswim,4606,40,5.0
ACM/IEEE Symposium on Edge Computing,SEC,CORE2023,unranked,none,http://dblp.org/db/conf/ieeesec/index.html,4606,0,N/A
ACM/IFIP/USENIX International Middleware Conference,Middleware,CORE2023,A,none,https://dblp.uni-trier.de/db/conf/middleware,4606,1,4.0
ACM/SIAM Symposium on Discrete Algorithms,SODA,CORE2023,A*,none,https://dblp.uni-trier.de/db/conf/soda,4613,0,N/A
ACM/SPEC International Conference on Performance Engineering,ICPE,CORE2023,B,none,https://dblp.org/db/conf/wosp,4612,0,N/A
ACM/SPIE Multimedia Computing and Networking,MMCN,CORE2018,A,none,none,0801,1,5.0
ACS/IEEE International Conference on Computer Systems and Applications,AICCSA,CORE2023,C,none,https://dblp.uni-trier.de/db/conf/aiccsa,46,0,N/A
Active and Real-Time Database Systems,ARTDB,CORE2018,C,none,none,0804,0,N/A
Advanced Concepts for Intelligent Vision Systems,ACIVS,CORE2023,B,none,https://dblp.uni-trier.de/db/conf/acivs,4603,1,3.0
Advanced Course on Artificial Intelligence,ACAI,CORE2018,C,none,none,0801,0,N/A
Advanced Research in VLSI,ARVLSI,CORE2018,C,none,none,0805,0,N/A
Advanced Visual Interfaces,AVI,CORE2023,B,none,https://dblp.uni-trier.de/db/conf/avi,4608,1,5.0
Advances in Cryptology,CRYPTO,CORE2023,A*,none,https://dblp.uni-trier.de/db/conf/crypto,4604,0,N/A
Advances in Information Systems,ADVIS,CORE2018,C,none,none,0806,0,N/A
Advances in Intelligent Systems,AIS,CORE2018,C,none,none,0801,0,N/A
Advances in Modal Logic,AiML,CORE2023,B,none,https://dblp.uni-trier.de/db/conf/aiml,4613,0,N/A
Advances in Neural Information Processing Systems (was NIPS),NeurIPS,CORE2023,A*,none,https://dblp.uni-trier.de/db/conf/nips,4611,0,N/A
Advances in the Theory of Computing,AITC,CORE2018,C,none,none,0802,0,N/A
Agent-Oriented Information Systems Workshop,AOIS,CORE2014,B,none,none,0801,0,N/A
Agent-Oriented Software Engineering Workshop (merged into EMAS in 2013),AOSE,ERA2010,C,none,none,0801,0,N/A
AIAA Aerospace Sciences Meeting,,ERA2010,B,none,none,0901,0,N/A
AIChE Annual Meeting,,ERA2010,C,none,none,09,0,N/A
AISB Convention (Society for the Study of Artificial Intelligence and Simulation of Behaviour),AISB,ERA2010,B,none,none,1203,0,N/A
Algebraic Methodology and Software Technology,AMAST,CORE2018,C,none,none,0802,0,N/A
Algorithmic Learning Theory,ALT,CORE2023,B,none,https://dblp.uni-trier.de/db/conf/alt,4611,0,N/A
Algorithms and Complexity in Durham,ACID,CORE2018,C,none,none,0802,0,N/A
Algorithms and Data Structures Symposium (was Workshop on Algorithms and Data Structures),WADS,CORE2023,B,none,https://dblp.uni-trier.de/db/conf/wads,4613,0,N/A
Algorithms and Experiments,ALEX,CORE2018,B,none,none,,0,N/A
Ambient Information Systems,AIS,ERA2010,B,none,none,1203,0,N/A
Ambient Intelligence Developments,Aml.d,CORE2018,C,none,none,0801,0,N/A
American Association of Cost Engineers Annual Meeting,AACE,ERA2010,A,none,none,1202,0,N/A
American Federation of Information Processing Societies,AFIPS,CORE2018,A,none,none,0801,0,N/A
American Medical Informatics Annual Fall Symposium,AMIA,CORE2023,National: USA,none,https://dblp.uni-trier.de/db/conf/amia,4601,2,5.0
"American Society for Heating, Refrigeration and Air Conditioning",ASHRAE,ERA2010,A,none,none,1202,0,N/A
American Society of Mechanical Engineering,,ERA2010,A,none,none,0913,0,N/A
Americas Conference on Information Systems,AMCIS,CORE2018,A,none,https://dblp.uni-trier.de/db/conf/amcis,0806,1,4.0
Americas Conference on Wind Engineering,,ERA2010,B,none,none,0905,0,N/A
Annual Computer Security Applications Conference,ACSAC,CORE2023,A,none,https://dblp.uni-trier.de/db/conf/acsac,4604,4,4.0
Annual conference of American Society for Information Science and Technology,ASIS&T,CORE2008,A,none,none,,0,N/A
Annual Conference of the Australasian Society for Computers in Learning in Tertiary Education,ASCILITE,CORE2018,Australasian,none,none,0899,0,N/A
Annual Conference of the Australian Acoustical Society,,ERA2010,A,none,none,0913,0,N/A
Annual Conference of the International Academy for Information Management,IAIM,CORE2018,C,none,none,0806,0,N/A
Annual Conference of the International Speech Communication Association (was Eurospeech),Interspeech,CORE2014,A,none,none,0801,0,N/A
Annual Conference on Computer Science Logic,CSL,CORE2023,B,none,https://dblp.uni-trier.de/db/conf/csl,4613,1,N/A
Annual Conference on Evolutionary Programming,EP,CORE2018,C,none,none,0801,0,N/A
Annual Conference on Innovation and Technology in Computer Science Education,ITiCSE,CORE2023,B,none,https://dblp.uni-trier.de/db/conf/iticse,4608,0,N/A
"Annual Conference on Privacy, Security and Trust",PST,CORE2023,C,none,https://dblp.uni-trier.de/db/conf/pst,4604,0,N/A
"Annual Convention for Survey, Mapping and Remote Sensing",RS,CORE2018,C,none,none,0909,0,N/A
Annual Fall Workshop on Computational Geometry,CGW,CORE2018,C,none,none,0802,0,N/A
"Annual IASTED International Conference on Networks, Parallel and Distributed Processing and Applications",NPDP,CORE2014,C,none,none,,0,N/A
Annual International Conference of the IEEE Engineering in Medicine and Biology Society,,ERA2010,A,none,none,0903,0,N/A
Annual International Conference on Ada,TRI-Ada,CORE2018,C,none,none,0803,0,N/A
Annual International Workshop on Presence,ISPR,CORE2023,C,See note,none,4607,0,N/A
Annual Meeting of the Cognitive Science Society,CogSci,CORE2023,B,See note,https://dblp.uni-trier.de/db/conf/cogsci,4602,0,N/A
Annual Meeting of the Decision Sciences Institute,DSI,CORE2018,C,none,none,0806,0,N/A
Annual Meeting of the Special Interest Group on Discourse and Dialog,SIGdial,CORE2023,B,none,https://dblp.uni-trier.de/db/conf/sigdial,4602,0,N/A
Annual PKI R&D Workshop,PKI,CORE2018,C,none,none,0803,0,N/A
Annual PPIG Workshop,PPIG,CORE2018,B,none,https://dblp.uni-trier.de/db/conf/ppig,0806,0,N/A
Annual Simulation Symposium,ANSS,CORE2018,B,none,none,0802,0,N/A
"Annual Water Distribution Systems Analysis Conference, WDSA 2008",,ERA2010,A,none,none,0905,0,N/A
AoM Organizational Communication and Information Systems,OCIS,CORE2018,A,none,none,0806,0,N/A
Apple University Consortium Academic and Developers Conference,AUCADC,CORE2018,C,none,none,0899,0,N/A
Application of Computers and Operations Research in the Minerals Industries,APCOMin,CORE2018,A,none,none,0909,0,N/A
Application of Concurrency to System Design,ACSD,CORE2021,B,none,https://dblp.uni-trier.de/db/conf/acsd,4606,0,N/A
Applications of Information Visualization,IV-App,CORE2023,C,none,none,4608,0,N/A
Applications of Natural Language to Data Bases,NLDB,CORE2023,C,none,https://dblp.uni-trier.de/db/conf/nldb,4602,0,N/A
Applied Computing Conference,ACC,CORE2023,C,none,none,4601,0,N/A
Applied Perception in Graphics and Visualization,APGV,CORE2018,C,none,none,0801,0,N/A
Architectural Support for Programming Languages and Operating Systems,ASPLOS,CORE2023,A*,none,https://dblp.uni-trier.de/db/conf/asplos,4612,0,N/A
Argentine Symposium on Artificial Intelligence,ASAI,CORE2017,C,none,none,0801,0,N/A
Argentine Workshop on Theoretical Informatics,AWTI,CORE2008,B,none,none,,0,N/A
Artificial Intelligence and Applications Conference,AIA,CORE2018,C,none,none,,0,N/A
Artificial Intelligence Applications and Innovations,AIAI,CORE2023,C,none,https://dblp.org/db/conf/aiai,4601,0,N/A
Artificial Intelligence in Knowledge Management,AIKM,CORE2018,C,none,none,0801,0,N/A
Artificial Intelligence in Medicine,AIIM,CORE2018,A,none,none,0801,0,N/A
Artificial Neural Networks in Engineering Conference,ANNIE,CORE2018,B,none,none,0801,0,N/A
"ArtsIT, Interactivity & Game Creation (was International Conference on Arts and Technology)",ArtsIT,CORE2023,C,none,https://dblp.uni-trier.de/db/conf/artsit,4607,0,N/A
ASCCS International Conference on Steel-Concrete Composite and Hybrid Structures,,ERA2010,A,none,none,0905,0,N/A
ASEE Annual Conference and Exposition,,ERA2010,B,none,none,09,0,N/A
ASEE Global Colloquium of Engineering Education,,ERA2010,B,none,none,09,0,N/A
Asia and South Pacific Design Automation Conference,ASPDAC,CORE2023,C,none,https://dblp.uni-trier.de/db/conf/aspdac,4606,0,N/A
"Asia Conference on Information, Computer and Communications Security",AsiaCCS,CORE2023,A,none,https://dblp.uni-trier.de/db/conf/asiaccs,4604,0,N/A
Asia Information Retrieval Symposium,AIRS,CORE2021,C,none,https://dblp.uni-trier.de/db/conf/airs,4605,0,N/A
Asia International Conference on Modelling and Simulation,AMS,CORE2018,C,none,none,0802,1,4.0
Asia Pacific Association for Medical Informatics Conference,APAMI,CORE2008,B,none,none,,0,N/A
Asia Pacific Conference on Combustion,,ERA2010,B,none,none,0913,0,N/A
Asia Pacific Conference on Communications,APCC,CORE2023,C,none,https://dblp.uni-trier.de/db/conf/apcc,4606,0,N/A
Asia Pacific Conference on Hardware Description Languages (was Asia Pacific CHipDesign Languages),APCHDL,CORE2018,C,none,none,1006,0,N/A
Asia Pacific Decision Science Institute Conference,APDSI,CORE2018,C,none,none,0802,0,N/A
Asia Pacific Industrial Engineering and Management Systems and Chinese Institute of Industrial Engineers Conference,APIEMS CIIEC,ERA2010,C,none,none,1203,0,N/A
Asia Pacific Research Symposium on Accounting Information Systems,APRSAIS,CORE2018,C,none,none,0806,0,N/A
Asia Pacific Symposium on Intelligent and Evolutionary Systems (was Australia-Japan Joint Workshop on  Intelligent and Evolutionary Systems),IES,CORE2023,C,none,none,4602,0,N/A
Asia-Pacific Bioinformatics Conference,APBC,CORE2023,B,none,https://dblp.uni-trier.de/db/conf/apbc,4601,0,N/A
Asia-Pacific Computer Human Interaction Conference,APCHI,CORE2018,C,none,none,1203,0,N/A
Asia-Pacific Conference on Complex Systems,Complex,CORE2018,C,none,none,0801,0,N/A
Asia-Pacific Conference on Conceptual Modelling,APCCM,CORE2023,Australasian C,none,none,4605,0,N/A
Asia-Pacific Conference on Engineering Plasticity and Its Applications,,ERA2010,A,none,none,0910,0,N/A
Asia-Pacific Conference on Materials Processing,,ERA2010,A,none,none,0910,0,N/A
Asia-Pacific Conference on Simulated Evolution and Learning,SEAL,CORE2020,B,none,https://dblp.uni-trier.de/db/conf/seal,4611,0,N/A
Asia-Pacific Conference on Wind Engineering,,ERA2010,B,none,none,0905,0,N/A
Asia-Pacific Forum on Engineering and Technology Education,AFETE,CORE2018,C,none,none,0999,0,N/A
Asia-Pacific Network Operations and Management Symposium,APNOMS,CORE2023,C,none,https://dblp.uni-trier.de/db/conf/apnoms,4606,0,N/A
Asia-Pacific Services Computing Conference,APSCC,CORE2023,C,none,none,4606,0,N/A
Asia-Pacific Software Engineering Conference,APSEC,CORE2023,C,See note,https://dblp.uni-trier.de/db/conf/apsec,4612,0,N/A
Asia-Pacific Vibration Conference,,ERA2010,B,none,none,0913,0,N/A
Asian Computing Science Conference,ASIAN,CORE2018,B,none,none,08,0,N/A
Asian Conference on Computer Vision,ACCV,CORE2023,B,none,https://dblp.uni-trier.de/db/conf/accv,4603,0,N/A
Asian Conference on Intelligent Information and Database Systems,ACIIDS,CORE2023,B,none,https://dblp.uni-trier.de/db/conf/aciids,4605,133,4.6
Asian Conference on Machine Learning,ACML,CORE2023,Unranked,none,https://dblp.uni-trier.de/db/conf/acml,4611,12,4.7
Asian Congress of Fluid Mechanics,,ERA2010,A,none,none,0901,0,N/A
Asian International Mobile Computing Conference,AMOC,CORE2018,C,none,none,0805,0,N/A
Asian Symposium on Computer Mathematics,ASCM,CORE2018,C,none,none,0802,0,N/A
ASIAN Symposium on Programming Languages and Systems,APLAS,CORE2023,B,none,https://dblp.uni-trier.de/db/conf/aplas,4612,0,N/A
Asian Symposium on Visualization,,ERA2010,B,none,none,0901,0,N/A
Asian-Pacific Conference on Computational Mechanics,APCOM,ERA2010,A,none,none,0905,0,N/A
Asian-Pacific conferences on unsaturated soils,Unsat-Asian,ERA2010,A,none,none,0905,0,N/A
"Asilomar Conference on Signals, Systems and Computing",ACSSC,CORE2023,National: USA,none,https://dblp.uni-trier.de/db/conf/acssc,4606,0,N/A
Aspect-Orientation Asia,AO-Asia,CORE2018,C,none,none,0803,0,N/A
Aspect-Oriented Software Development,AOSD,CORE2018,A,none,none,0803,0,N/A
Association for Computational Linguistics,ACL,CORE2023,A*,none,https://dblp.uni-trier.de/db/conf/acl,4602,0,N/A
Association for Computer Aided Design in Architecture (ACADIA) Conference,ACADIA,ERA2010,A,none,none,1201,0,N/A
Association for Computer-Aided Architectural Design Research in Asia (CAADRIA) annual conference,CAADRIA,CORE2023,C,See note,none,4601,0,N/A
Association of Architecture Schools of Australasia Annual Conference (AASA),AASA,ERA2010,C,none,none,1201,0,N/A
Association of Collegiate Schools of Architecture (ACSA) Annual Meeting,ACSA,ERA2010,B,none,none,1201,0,N/A
Association of Researchers in Construction Management Annual Conference,ARCOM,ERA2010,A,none,none,1202,0,N/A
Athens Colloquium on Algorithms and Complexity,ACAC,ERA2010,C,none,none,0802,0,N/A
AUSIMM Orebody Modelling and Strategic Mine Planning Conference,,ERA2010,A,none,none,0914,0,N/A
AUSIMM Project Evaluation,,ERA2010,A,none,none,0914,0,N/A
Australasia Conference on Information Security and Privacy,AISP,CORE2018,Australasian,none,none,0806,0,N/A
Australasian Coasts and Ports Conference,,ERA2010,A,none,none,0911,0,N/A
Australasian Cognitive Science Society Conference,AuCSS,CORE2018,Australasian,none,none,0801,0,N/A
Australasian Compumod Users' Conference,COMPUMOD,CORE2018,Australasian,none,none,0803,0,N/A
Australasian Computer Architecture Conference,ACAC,CORE2018,Australasian,none,none,0803,0,N/A
Australasian Computer Music Conference,ACMA,CORE2018,Australasian,none,none,0899,0,N/A
Australasian Computer Science Conference,ACSC,CORE2018,Australasian,none,none,08,0,N/A
Australasian Computer Systems Architecture Conference (now Asia-Pacific Computer Systems Architecture Conference),ACSAC,CORE2018,Australasian,none,none,0803,0,N/A
Australasian Computers in Education Conference,ACEC,CORE2018,Australasian,none,none,0899,0,N/A
Australasian Computing Education Conference (ACE),ACE,CORE2023,Australasian B,none,https://dblp.uni-trier.de/db/conf/ace,4608,1,4.0
Australasian Conference on Combinatorial Mathematics and Combinatorial Computing,ACCMCC,CORE2023,Australasian C,none,none,4613,0,N/A
Australasian Conference on Information Security and Privacy,ACISP,CORE2023,Australasian B,none,https://dblp.uni-trier.de/db/conf/acisp,4604,1,4.0
Australasian Conference on Information Systems,ACIS,CORE2018,Australasian,none,none,0806,0,N/A
Australasian Conference on Parallel and Real-Time Systems,APRTS,CORE2018,Australasian,none,none,0805,0,N/A
Australasian Conference on Pattern Languages of Programs,KoalaPLoP,CORE2018,Australasian,none,none,0803,0,N/A
