Title,Acronym,Source,Rank,Note,DBLP,Primary FoR,Comments,Average Rating
Information Visualization in Biomedical Informatics,IVBI,CORE2023,C,none,none,4601,0,N/A
Informing Science and Information Technology Education,InSITE,CORE2023,C,none,none,4608,0,N/A
Infrastructure and Environment (International Postgraduate Conference),IPC,ERA2010,B,none,none,1202,0,N/A
Innovations in Theoretical Computer Science,ITCS,CORE2023,A,none,https://dblp.uni-trier.de/db/conf/innovations,4613,0,N/A
Innovative Applications in AI,IAAI,CORE2023,C,See note,none,4602,0,N/A
Institute for Small Business and Entrepreneurship Annual Conference,ISBE,CORE2018,C,none,none,0806,0,N/A
Int. Workshop on Formal Methods for Industrial Critical Systems,FMICS,CORE2023,C,none,https://dblp.uni-trier.de/db/conf/fmics,4612,0,N/A
Int. Workshop on Multi-Media Data Base Management Systems,IW-MMDBMS,CORE2018,C,none,none,0804,0,N/A
Integrated Data Environments Australia Workshop,IDEAW,CORE2018,Australasian,none,none,0804,0,N/A
Integrated Formal Methods,IFM,CORE2023,B,none,https://dblp.uni-trier.de/db/conf/ifm,4612,0,N/A
Integration of Software Engineering and Agent Technology,ISEAT,CORE2018,B,none,none,0801,0,N/A
"Intelligence Tools, Data Mining, Visualization",IDV,CORE2018,C,none,none,0801,0,N/A
Intelligent Data Analysis,IDA,CORE2023,B,none,https://dblp.uni-trier.de/db/conf/ida,4605,0,N/A
Intelligent Distributed Computing,IDC,CORE2023,Unranked,none,https://dblp.uni-trier.de/db/conf/idc,4606,0,N/A
"Intelligent Multimedia, Computing and Communications Technologies and Applications of the Future",CCTAF,CORE2018,C,none,none,,0,N/A
Intelligent Systems in Molecular Biology,ISMB,CORE2023,journal published,none,https://dblp.uni-trier.de/db/conf/ismb,4601,1,N/A
Intelligent Vehicles Conference,IEEE-IV,CORE2023,B,none,https://dblp.uni-trier.de/db/conf/ivs,4602,0,N/A
Intelligent Vehicles Symposium,IEEE IV,ERA2010,B,none,none,0902,0,N/A
Intelligent Virtual Agents,IVA,CORE2023,B,none,https://dblp.uni-trier.de/db/conf/iva,4602,1,4.0
Intenational Environmental Modelling and Software Society,iEMSs,CORE2023,C,none,none,4601,0,N/A
Interaction,Interaction,CORE2018,C,none,none,0806,0,N/A
Interaction Design and Children (ACM),IDC,CORE2023,B,none,none,4608,0,N/A
Interactive Entertainment,IE,CORE2023,Australasian C,none,none,4607,0,N/A
Interior Design Educators Association (IDEA) Conference,IDEA,ERA2010,B,none,none,1201,0,N/A
Interiors Forum Scotland conference,IFS,ERA2010,B,none,none,1201,0,N/A
"Interiors Forum World, Politecnico di Milano",IFW,ERA2010,B,none,none,1201,0,N/A
International ACM SIGACCESS Conference on Computers and Accessibility,ASSETS,CORE2023,A,none,https://dblp.uni-trier.de/db/conf/assets,4608,0,N/A
International and Interdisciplinary Conference on Modelling and Using Context,CONTEXT,CORE2021,C,none,https://dblp.uni-trier.de/db/conf/context,4602,0,N/A
International Association for the Study of Traditional Environments (US),IASTE,ERA2010,B,none,none,1201,0,N/A
International Association of Ergonomics Societies Congress,IEA,ERA2010,B,none,none,1203,0,N/A
International Association of Societies of Design Research,IASDR,ERA2010,B,none,none,1201,1,5.0
International Atlantic Web Intelligence Conference,AWIC,CORE2018,C,none,none,0801,0,N/A
International Baltic Conference on Databases and Information Systems,DB&IS,CORE2023,Regional - Baltic,none,https://dblp.uni-trier.de/db/conf/balt,4605,0,N/A
International Business Information Management,IBIMA,CORE2018,B,none,none,0806,0,N/A
International Cognitive Robotics Conference,COGROBO,CORE2018,B,none,none,0801,0,N/A
International Colloquium on Automata Languages and Programming,ICALP,CORE2023,A,none,https://dblp.uni-trier.de/db/conf/icalp,4613,2,5.0
"International Colloquium on Data Sciences, Knowledge Discovery and Business Intelligence",DSKDB,CORE2018,C,none,none,0801,0,N/A
International Colloquium on Structural Information and Communication Complexity,SIROCCO,CORE2023,B,none,https://dblp.uni-trier.de/db/conf/sirocco,4613,1,4.0
International Colloquium on Theoretical Aspects of Computing,ICTAC,CORE2023,C,none,https://dblp.uni-trier.de/db/conf/ictac,4613,0,N/A
International Command and Control Research and Technology Symposium,CCRTS,CORE2018,C,none,none,,0,N/A
International Command and Control Research and Technology Symposium,ICCRTS,ERA2010,C,none,none,0905,0,N/A
International Computer Science Conference,ICSC,CORE2018,B,none,none,08,0,N/A
International Computer Science Symposium in Russia,CSR,CORE2023,National: Russia,none,https://dblp.uni-trier.de/db/conf/csr,46,3,4.0
International Computer Software and Applications Conference,COMPSAC,CORE2023,B,none,https://dblp.uni-trier.de/db/conf/compsac,4601,0,N/A
International Computer Symposium Conference,ICSC2,CORE2018,A,none,none,,0,N/A
International Computer Symposium Workshop,WICS,CORE2018,C,none,none,,0,N/A
International Computing Education Research Workshop,ICER,CORE2023,A,none,https://dblp.uni-trier.de/db/conf/icer,4608,0,N/A
"International Conference Abstract State Machines, Alloy, B, TLA, VDM, and Z (Previously International Conference of B and Z Users, ZB, changed in 2008)",ABZ,CORE2023,C,none,https://dblp.uni-trier.de/db/conf/zum,4612,0,N/A
International Conference and Exhibition on High Performance Computing in the Asia-Pacific Region,HPC Asia,CORE2023,C,none,https://dblp.uni-trier.de/db/conf/hpcasia,4606,0,N/A
International Conference and Workshops on Algorithms and Computation,WALCOM,CORE2023,B,none,https://dblp.uni-trier.de/db/conf/walcom,4613,0,N/A
"International Conference Computer Graphics, Imaging and Visualization",CGIV,CORE2018,C,none,none,0801,0,N/A
"International Conference for Bulk Materials Storage, Handling and Transportation",,ERA2010,A,none,none,0910,0,N/A
"International Conference for High Performance Computing, Networking, Storage and Analysis (was Supercomputing Conference)",SC,CORE2023,A,none,https://dblp.uni-trier.de/db/conf/sc,CSE,0,N/A
International Conference Formal Concept Analysis Conference,ICFCA,CORE2023,C,none,https://dblp.uni-trier.de/db/conf/icfca,4613,1,4.0
"International Conference Imaging Science, Systems and Technology",CISST,CORE2018,C,none,none,0801,0,N/A
International Conference in Business Process Management,BPM,CORE2023,A,none,https://dblp.uni-trier.de/db/conf/bpm,4612,4,4.8
International Conference in Methodologies and Intelligent Systems for Technology Enhanced Learning,MIS4TEL,CORE2023,National: Spain,none,https://dblp.org/db/conf/mis4tel,4601,0,N/A
International Conference Information Systems Architecture and Technology,ISAT,CORE2021,National:Poland,none,https://dblp.org/db/conf/isat,4606,0,N/A
International Conference of Asian Digital Libraries,ICADL,CORE2018,A,none,none,,0,N/A
"International Conference of Broadband Communication, Information Technology and Biomedical Applications",broadcom,ERA2010,C,none,none,1005,0,N/A
International Conference of Society for Group Decision and Negotiation,GDN,CORE2018,B,none,none,0806,0,N/A
International Conference of the Immersive Learning Research Network,iLRN,CORE2023,C,none,https://dblp.org/db/conf/ilrn,4601,2,5.0
International Conference of the International Association for Computer Methods and Advances in Geomechanics,IACMAG,ERA2010,A,none,none,0905,0,N/A
International Conference on 3G Mobile Communication Technologies,3G,CORE2018,C,none,none,0801,0,N/A
International Conference on AD-HOC Networks and Wireless,ADHOC-NOW,CORE2021,C,none,https://dblp.org/db/conf/adhoc-now,4606,0,N/A
International Conference on Adaptive and Natural Computing Algorithms,ICANNGA,CORE2018,C,none,none,0801,0,N/A
International Conference on Advanced and Trusted Computing (was International Conference on Autonomic and Trusted Computing),ATC,CORE2023,C,none,https://dblp.uni-trier.de/db/conf/atc,4604,0,N/A
International Conference on Advanced Computing and Communications,AdCom,CORE2023,National: India,none,none,4606,0,N/A
International Conference on Advanced Data Mining and Applications,ADMA,CORE2023,C,none,https://dblp.uni-trier.de/db/conf/adma,4605,0,N/A
International Conference on Advanced Information Management,IMS,CORE2018,C,none,none,0806,0,N/A
International Conference on Advanced Information Networking and Applications (was ICOIN),AINA,CORE2023,B,none,https://dblp.uni-trier.de/db/conf/aina,4606,3,4.3
International Conference on Advanced Information Systems Engineering,CaiSE,CORE2023,A,none,https://dblp.uni-trier.de/db/conf/caise,4605,2,4.5
International Conference on Advanced Language Processing and Web Information Technology,ALPIT,CORE2018,C,none,none,0806,0,N/A
International Conference on Advanced Materials Processing,,ERA2010,B,none,none,0910,0,N/A
International Conference on Advanced Technologies For Signal & Image Processing,ATSIP,CORE2023,National: Tunisia,none,https://dblp.org/db/conf/atsip,4603,2,5.0
International Conference on Advances and Trends in Engineering Materials and Their Applications,,ERA2010,A,none,none,0910,0,N/A
International Conference on Advances in Computer-Human Interactions,ACHI,CORE2023,C,none,none,4608,0,N/A
"International Conference on Advances in Infrastructure for Electronic Business, Science, and Education on the Internet",SSGRR,CORE2018,C,none,none,0806,0,N/A
International Conference on Advances in Intelligent Systems: Theory and Applications,AISTA,CORE2018,B,none,none,0801,0,N/A
International Conference on Advances in Materials and Processing Technologies,,ERA2010,A,none,none,0910,0,N/A
International Conference on Advances in Mobile Computing and Multimedia,MOMM,CORE2023,C,See note,https://dblp.uni-trier.de/db/conf/momm,4606,0,N/A
International Conference on Advances in Pattern Recognition and Digital Techniques,ICAPRDT,CORE2018,C,none,none,0801,0,N/A
International Conference on Affective Computing and Intelligent,ACII,CORE2023,C,none,https://dblp.uni-trier.de/db/conf/acii,4608,4,5.0
International Conference on Agents and Artificial Intelligence,ICAART,CORE2023,B,none,https://dblp.uni-trier.de/db/conf/icaart,4602,0,N/A
International Conference On Agile Manufacturing,,ERA2010,A,none,none,0910,0,N/A
"International Conference on Agile Software Development (chnaged in 2010, was International Conference on extreme Programming and Flexible Processes in Software Engineering)",XP,CORE2018,B,none,none,0803,0,N/A
International Conference on AI in Design,AID,CORE2018,A,none,none,0801,0,N/A
International Conference on Algebraic and Logic Programming,ALP,CORE2018,B,none,none,0802,0,N/A
International Conference on Algorithms and Architectures for Parallel Processing,ICA3PP,CORE2023,C,none,https://dblp.uni-trier.de/db/conf/ica3pp,4606,0,N/A
International Conference on Algorithms and Complexity (was Italian Conference ),CIAC,CORE2023,C,none,https://dblp.uni-trier.de/db/conf/ciac,4613,0,N/A
"International Conference on Analysis of Images, Social Networks and Texts",AIST,CORE2023,National: Russia,none,https://dblp.org/db/conf/aist,4602,0,N/A
"International Conference on Application-specific Systems, Architectures and Processors",ASAP,CORE2018,A,none,https://dblp.uni-trier.de/db/conf/asap,0805,0,N/A
International Conference on Applications of Evolutionary Computation,EvoApplications,CORE2023,B,none,https://dblp.org/db/conf/evoW/evoappl2019.html,4602,1,5.0
International Conference on Applications of Prolog (no information after 2013),INAP,CORE2014,C,none,none,,0,N/A
International Conference on Applied Cryptography and Network Security,ACNS,CORE2023,B,none,https://dblp.uni-trier.de/db/conf/acns,4604,1,5.0
International Conference on Artificial Intelligence,IC-AI,CORE2023,National: USA,none,none,4602,0,N/A
International Conference on Artificial Intelligence and Law,ICAIL,CORE2023,C,none,https://dblp.uni-trier.de/db/conf/icail,4602,0,N/A
International Conference on Artificial Intelligence and Pattern Recognition,AIPR,CORE2018,C,none,none,0801,0,N/A
International Conference on Artificial Intelligence and Soft Computing,ICAISC,CORE2023,National: Poland,none,https://dblp.uni-trier.de/db/conf/icaisc,4602,34,4.9
International Conference on Artificial Intelligence and Statistics,AISTATS,CORE2023,A,none,https://dblp.uni-trier.de/db/conf/aistats,4611,8,5.0
International Conference on Artificial Intelligence in Education,AIED,CORE2023,A,none,https://dblp.uni-trier.de/db/conf/aied,4601,0,N/A
International Conference on Artificial Intelligence in Medicine,AIME,CORE2023,B,none,https://dblp.uni-trier.de/db/conf/aime,4601,0,N/A
"International Conference on Artificial Intelligence in Music, Sound, Art and Design",EvoMUSART,CORE2023,C,none,https://dblp.org/db/conf/evomusart/,4602,1,5.0
International Conference on Artificial Intelligence in Science and Technology,AISAT,CORE2018,C,none,none,0801,0,N/A
"International Conference on Artificial Intelligence: Methodology, Systems, Applications",AIMSA,CORE2023,National: Bulgaria,none,https://dblp.uni-trier.de/db/conf/aimsa,4602,0,N/A
International Conference on Artificial Neural Networks,ICANN,CORE2023,C,none,https://dblp.uni-trier.de/db/conf/icann,4611,0,N/A
International Conference on Artificial Neural Networks and Genetic Algorithms,ICANNGA,CORE2018,C,none,none,,0,N/A
International Conference on Artificial Reality and Telexistance & Eurographics Symposium on Virtual Environments,EGVE,CORE2023,C,See note,https://dblp.uni-trier.de/db/conf/egve,4607,0,N/A
International Conference on Artificial Reality and Telexistence,ICAT,CORE2017,B,none,https://dblp.uni-trier.de/db/conf/icat,0801,0,N/A
International Conference on Automated Deduction,CADE,CORE2023,A,none,https://dblp.uni-trier.de/db/conf/cade,4602,0,N/A
International Conference on Automated Planning and Scheduling,ICAPS,CORE2023,A*,none,https://dblp.uni-trier.de/db/conf/icaps,4602,0,N/A
"International Conference on Automation, Robotics and Control Systems",ARCS,ERA2010,C,none,none,0910,0,N/A
"International Conference on Availability, Reliability and Security",ARES,CORE2023,B,none,https://dblp.uni-trier.de/db/conf/IEEEares,4604,0,N/A
International Conference on Biomedical and Pharmaceutical Engineering,,ERA2010,B,none,none,0903,0,N/A
"International Conference on Broadband Communications, Networks and Systems",Broadnets,CORE2023,C,none,https://dblp.uni-trier.de/db/conf/broadnets,4606,0,N/A
International Conference on Business Information Systems,BIS,CORE2018,B,none,none,0806,0,N/A
"International Conference on CAD/CAM, Robotics and Factories of the Future",RFF,CORE2018,C,none,none,0910,0,N/A
International Conference on Case-Based Reasoning,ICCBR,CORE2023,C,See note,https://dblp.uni-trier.de/db/conf/iccbr,4602,2,4.0
International Conference on Chinese Computing,ICCC,CORE2018,C,none,none,0899,0,N/A
"International Conference on Civil, Structural and Environmental Engineering Computing",CIVIL-COMP,ERA2010,A,none,none,09,0,N/A
International Conference on Cloud Computing and Services Science,CLOSER,CORE2023,C,none,https://dblp.uni-trier.de/db/conf/closer,4606,0,N/A
International Conference on Coastal Engineering,,ERA2010,A,none,none,0905,0,N/A
"International Conference on Collaborative Computing: Networks, Applications and Worksharing",CollaborateCom,CORE2023,C,none,https://dblp.uni-trier.de/db/conf/colcom,4606,1,4.0
International Conference on Communication System Software and Middleware,COMSWARE,CORE2018,C,none,none,0803,0,N/A
International Conference on COMmunication Systems & NETworkS,COMSNETS,CORE2023,National:India,none,https://dblp.org/db/conf/comsnets,4606,0,N/A
International Conference on Communication Systems and Applications,ICCSA,CORE2023,C,none,none,4606,0,N/A
International Conference on Communications in Computing,CIC,CORE2018,C,none,none,0805,0,N/A
International Conference on Compiler Construction,CC,CORE2023,B,none,https://dblp.uni-trier.de/db/conf/cc,4606,0,N/A
"International Conference on Compilers, Architecture, and Synthesis for Embedded Systems",CASES,CORE2023,B,none,https://dblp.uni-trier.de/db/conf/cases,4606,0,N/A
International Conference on Complex Systems,CxS,CORE2018,C,none,none,0905,0,N/A
"International Conference on Complex, Intelligent and Software Intensive Systems",CISIS,CORE2023,C,none,https://dblp.uni-trier.de/db/conf/cisis,4606,1,N/A
"International Conference on Complexity, Future Information Systems and Risk",COMPLEXIS,CORE2023,C,none,http://dblp.uni-trier.de/db/conf/complexis,4613,0,N/A
International Conference on Composite Materials,,ERA2010,A,none,none,0910,0,N/A
International Conference on Computability and Complexity in Analysis,CCA,CORE2023,C,none,none,4613,0,N/A
International Conference on Computational Collective Intelligence,ICCCI,CORE2023,B,none,https://dblp.uni-trier.de/db/conf/iccci,4602,73,4.7
International Conference on Computational Creativity,ICCC,CORE2023,C,none,https://dblp.uni-trier.de/db/conf/icccrea,46,1,5.0
International Conference on Computational Engineering Science,ICES,CORE2018,C,none,none,0802,1,N/A
International Conference on Computational Intelligence and Multimedia,ICCIMA,CORE2018,C,none,none,0801,0,N/A
International Conference on Computational Intelligence and Security,CIS,CORE2023,National: China,none,https://dblp.uni-trier.de/db/conf/cis,4604,0,N/A
International Conference on Computational Intelligence and Software Engineering,CISE,CORE2014,C,none,none,0801,0,N/A
"International Conference on Computational Intelligence for Modelling, Control and Automation",CIMCA,CORE2018,C,none,none,0801,0,N/A
"International Conference on Computational Intelligence, Robotics and Autonomous Systems",CIRAS,CORE2018,C,none,none,0801,0,N/A
International Conference on Computational Linguistics,COLING,CORE2023,B,See note,https://dblp.uni-trier.de/db/conf/coling,4602,5,5.0
International Conference on Computational Molecular Biology,RECOMB,CORE2023,B,none,https://dblp.uni-trier.de/db/conf/recomb,4601,0,N/A
International Conference on Computational Plasticity,COMPLAS,ERA2010,A,none,none,0905,0,N/A
International Conference on Computational Science,ICCS,CORE2023,Multiconference,none,https://dblp.uni-trier.de/db/conf/iccS,4601,5,5.0
International Conference on Computational Science and its Applications,ICCSA,CORE2023,C,none,https://dblp.uni-trier.de/db/conf/iccsa,46,0,N/A
International Conference on Computational Semiotics for Games and New Media,Cosign,CORE2018,C,none,none,0801,0,N/A
International Conference on Computer Analysis of Images and Patterns,CAIP,CORE2023,C,See note,https://dblp.uni-trier.de/db/conf/caip,4603,0,N/A
International Conference on Computer Communication and Networks,ICCCN,CORE2023,B,none,https://dblp.uni-trier.de/db/conf/icccn,4606,1,N/A
"International Conference on Computer Graphics, Virtual Reality, Visualisation and Interaction in Africa",AFRIGRAPH,CORE2018,C,none,none,0801,0,N/A
International Conference on Computer Information Systems and Industrial Management Applications,CISIM,CORE2018,C,none,none,0806,2,5.0
"International Conference on Computer Safety, Reliability and Security",SAFECOMP,CORE2023,B,none,https://dblp.uni-trier.de/db/conf/safecomp,4604,0,N/A
International Conference on Computer Supported Cooperative Work in Design,CSCWD,CORE2023,C,See note,https://dblp.uni-trier.de/db/conf/cscwd,4608,0,N/A
International Conference on Computer Supported Education,CSEDU,CORE2023,B,none,http://dblp.uni-trier.de/db/conf/csedu,4608,0,N/A
International Conference on Computer Theory and Applications,ICCTA,CORE2018,C,none,none,0801,0,N/A
International Conference on Computer Vision and Graphics,ICCVG,CORE2023,National: Poland,none,https://dblp.uni-trier.de/db/conf/iccvg,4603,0,N/A
International Conference on Computer Vision Systems,ICVS,CORE2023,C,none,https://dblp.uni-trier.de/db/conf/icvs,4603,0,N/A
International Conference on Computer-Human Interaction Research and Applications,CHIRA,CORE2023,C,none,https://dblp.uni-trier.de/db/conf/chira,4608,0,N/A
International Conference on Computers and their Applications,CATA,CORE2023,National: USA,none,https://dblp.uni-trier.de/db/conf/cata,4601,0,N/A
International Conference on Computers Helping People with Special Needs,ICCHP,CORE2023,C,none,https://dblp.uni-trier.de/db/conf/icchp,4601,0,N/A
International Conference on Computers in Education,ICCE,CORE2023,C,See note,none,4601,2,4.0
International Conference on Computers in Urban Planning and Urban Management,CUPUM,ERA2010,A,none,none,1205,0,N/A
International Conference on Computing and Combinatorics,COCOON,CORE2023,National:China,none,https://dblp.uni-trier.de/db/conf/cocoon,4613,3,4.5
International Conference on Computing and Informatics,ICOCI,CORE2023,C,none,none,46,0,N/A
International Conference on Computing and Information,ICCI,CORE2018,B,none,none,,0,N/A
International Conference on Computing Education Research (Baltic Sea Conference on Computing Education Research prior to 2008),Koli Calling,ERA2010,B,none,none,0899,0,N/A
International Conference on Conceptual Modelling,ER,CORE2023,A,none,https://dblp.uni-trier.de/db/conf/er,4605,0,N/A
International Conference on Conceptual Structures,ICCS,CORE2021,B,none,https://dblp.uni-trier.de/db/conf/iccs,4613,0,N/A
International Conference on Concurrency Theory,CONCUR,CORE2023,A,none,https://dblp.uni-trier.de/db/conf/concur,4613,0,N/A
International Conference on Construction and Real Estate Management,ICCREM,ERA2010,B,none,none,1202,0,N/A
International Conference on Construction Engineering and Management,ICCEM,ERA2010,C,none,none,0905,0,N/A
International Conference on Construction in Developing Countries,ICCIDC,ERA2010,C,none,none,1202,0,N/A
"International Conference on Control, Automation, Robotics and Vision",ICARCV,CORE2023,C,none,https://dblp.uni-trier.de/db/conf/icarcv,4602,0,N/A
"International Conference on Control, Decision and Information Technologies",CoDIT,CORE2023,C,none,https://dblp.org/db/conf/codit,4612,1,4.0
International Conference on Convergence and Hybrid Information Technology,ICHIT,CORE2018,C,none,none,0899,0,N/A
International Conference on Cooperative Information Systems,CoopIS,CORE2023,B,none,none,4608,0,N/A
International Conference on Coordination Models and Languages,Coordination,CORE2023,C,none,https://dblp.uni-trier.de/db/conf/coordination,4606,0,N/A
International Conference on Creating Connecting and Collaborating through Computing,C5,CORE2018,C,none,none,0806,0,N/A
International Conference on Cryptology and Network Security,CANS,CORE2023,B,none,https://dblp.uni-trier.de/db/conf/cans,4604,0,N/A
International Conference on Cryptology in India,INDOCRYPT,CORE2023,National: India,none,https://dblp.uni-trier.de/db/conf/indocrypt,4604,0,N/A
International Conference on Cybercrime Forensics Education and Training,CFET,CORE2018,C,none,none,0801,0,N/A
International Conference on Cyberworlds (was International Symposium on Cyberworlds),CW,CORE2023,C,See note,https://dblp.uni-trier.de/db/conf/cw,4607,2,5.0
International Conference on Data Engineering,ICDE,CORE2023,A*,none,https://dblp.uni-trier.de/db/conf/icde,4605,0,N/A
"International Conference on Data Science, Technology and Applications",DATA,CORE2023,C,none,https://dblp.uni-trier.de/db/conf/data,4605,0,N/A
International Conference on Database and Expert Systems Applications,DEXA,CORE2023,C,See note,https://dblp.uni-trier.de/db/conf/dexa,4605,0,N/A
International Conference on Database Systems for Advanced Applications,DASFAA,CORE2023,B,none,https://dblp.uni-trier.de/db/conf/dasfaa,4605,0,N/A
International Conference on Database Theory,ICDT,CORE2023,A,none,https://dblp.uni-trier.de/db/conf/icdt,4605,0,N/A
International Conference on Decision Support Through Knowledge Management,DSTKM,CORE2018,C,none,none,,0,N/A
International Conference on Declarative Programming and Knowledge Management (no information after 2013),INAP,CORE2014,C,none,none,0802,0,N/A
International Conference on Dependability of Computer Systems,DEPCoS,CORE2023,National: Poland,none,https://dblp.uni-trier.de/db/conf/depcos,4606,7,4.9
"International Conference on Dependable, Autonomic and Secure Computing",DASC,CORE2023,C,none,https://dblp.uni-trier.de/db/conf/dasc,4604,0,N/A
International Conference on Design Science Research in Information Systems and Technology,DESRIST,CORE2018,A,none,https://dblp.uni-trier.de/db/conf/desrist,0806,0,N/A
International Conference on Design Theory and Methodology (ASME),DTM,ERA2010,A,none,none,1203,0,N/A
"International Conference on Digital Content, Multimedia Technology and its Applications",IDC,CORE2018,C,none,none,0806,0,N/A
International Conference on Digital Economy,ICDEc,CORE2018,Unranked,none,https://dblp.uni-trier.de/db/conf/icdec,0806,0,N/A
International Conference on Digital Government Research,DGO,CORE2018,B,none,none,0806,0,N/A
International Conference on Digital Society,ICDS,CORE2023,C,none,none,4601,0,N/A
International Conference on Discrete Geometry for Computer Imagery,DGCI,CORE2021,C,none,https://dblp.uni-trier.de/db/conf/dgci,4607,1,4.0
International Conference on Discrete Mathematics and Theoretical Computer Science,DMTCS,CORE2018,B,none,none,0802,0,N/A
International Conference on Distributed Computing and Artificial Intelligence,DCAI,CORE2023,National(Spain),none,https://dblp.org/db/conf/dcai,4602,0,N/A
International Conference on Distributed Computing and Internet Technologies,ICDCIT,CORE2023,National: India,none,https://dblp.uni-trier.de/db/conf/icdcit,4606,0,N/A
International Conference on Distributed Computing and Networking,ICDCN,CORE2023,National: India,none,https://dblp.uni-trier.de/db/conf/icdcn,4606,7,4.7
International Conference on Distributed Computing Systems,ICDCS,CORE2023,A,none,https://dblp.uni-trier.de/db/conf/icdcs,4606,4,5.0
International Conference on Distributed Frameworks for Multimedia Applications,DFMA,CORE2018,C,none,none,0805,0,N/A
International Conference on Dublin Core and Metadata Applications,DC,CORE2023,C,none,none,4605,0,N/A
International Conference on e-Business,ICEB,CORE2018,B,none,none,0806,0,N/A
International Conference on Electronic Commerce,ICEC,CORE2023,C,none,none,4601,0,N/A
International Conference on Electronic Commerce and Web Technology,ECWeb,CORE2018,B,none,none,0806,0,N/A
International Conference on Electronic Voting,EVOTE,CORE2018,C,none,none,0804,0,N/A
