Title,Acronym,Source,Rank,Note,DBLP,Primary FoR,Comments,Average Rating
International Symposium on Combinatorial Optimisation,ISCO,CORE2023,C,none,https://dblp.uni-trier.de/db/conf/iscopt,4613,1,5.0
International Symposium on Combustion,,ERA2010,A,none,none,0913,0,N/A
International Symposium on Communications and Information Technologies,ISCIT,ERA2010,B,none,none,1005,0,N/A
International Symposium on Computational Geomechanics,,ERA2010,A,none,none,0905,0,N/A
International Symposium on Computational Geometry,SoCG,CORE2023,A,none,https://dblp.uni-trier.de/db/conf/compgeom,4613,2,5.0
International Symposium on Computational Life Science,CompLife,CORE2018,B,none,none,0801,0,N/A
International Symposium on Computer and Information Sciences,ISCIS,CORE2020,C,none,https://dblp.uni-trier.de/db/conf/iscis,46,0,N/A
International Symposium on Computer Architecture and High Performance Computing,SBAC-PAD,CORE2023,C,See note,https://dblp.uni-trier.de/db/conf/sbac-pad,4606,0,N/A
International Symposium on Computer Design,COMPDES,CORE2018,C,none,none,1005,0,N/A
International Symposium on Cooperative Database Systems for Advanced Applications,CODAS,CORE2018,C,none,none,0804,0,N/A
"International Symposium on Data, privacy and E-Commerce",ISDPE,CORE2018,C,none,none,0803,0,N/A
International Symposium on Distributed Computing (was WDAG),DISC,CORE2023,A,none,https://dblp.uni-trier.de/db/conf/wdag,4606,0,N/A
International Symposium on Distributed Simulation and Real Time Applications,DS-RT,CORE2023,C,none,https://dblp.uni-trier.de/db/conf/dsrt,4606,0,N/A
International Symposium on Empirical Software Engineering,ISESE,CORE2018,B,none,none,0803,0,N/A
International Symposium on Empirical Software Engineering and Measurement,ESEM,CORE2023,A,none,https://dblp.uni-trier.de/db/conf/esem,4612,1,5.0
"International Symposium on Environmental Vibrations: Prediction, Monitoring, Mitigation and Evaluation",,ERA2010,B,none,none,0905,0,N/A
International Symposium on Experimental Algorithms,SEA,CORE2023,B,none,https://dblp.uni-trier.de/db/conf/wea,4613,0,N/A
International Symposium on Fault-Tolerant Computing,FTCS,ERA2010,C,none,none,0905,0,N/A
International Symposium on Formal Methods (was Formal Methods Europe FME),FM,CORE2023,A,none,https://dblp.uni-trier.de/db/conf/fm,4612,1,4.0
International Symposium on Foundations of Intelligent Systems,ISMIS,CORE2023,C,none,https://dblp.uni-trier.de/db/conf/ismis,4602,0,N/A
International Symposium on frontiers in offshore geotechnics,,ERA2010,B,none,none,0905,0,N/A
International Symposium on Functional and Logic Programming,FLOPS,CORE2023,National: Japan,none,https://dblp.uni-trier.de/db/conf/flops,4613,0,N/A
International Symposium on Fundamentals of Computation Theory,FCT,CORE2023,B,none,https://dblp.uni-trier.de/db/conf/fct,4613,1,4.0
International Symposium on Future Software Technology,ISFST,CORE2018,C,none,none,0803,0,N/A
International Symposium on Grids and Clouds (was International Symposium on Grid Computing),ISGC,CORE2023,C,none,none,4606,0,N/A
International Symposium on High Performance Computer Architecture,HPCA,CORE2023,A*,none,https://dblp.uni-trier.de/db/conf/hpca,CSE,0,N/A
International Symposium on Information and Communication Technologies,ISICT,CORE2020,C,none,https://dblp.uni-trier.de/db/conf/isict,46,0,N/A
International Symposium on Information Assurance and Security,IAS,CORE2023,C,none,none,4604,0,N/A
International Symposium on Information Processing,ISIP,CORE2018,C,none,none,0806,0,N/A
International Symposium on Information Theory and Its Applications,ISITA,CORE2023,C,See note,https://dblp.uni-trier.de/db/conf/isita,4613,0,N/A
International Symposium on Innovations in Intelligent Systems and Applications,INISTA,CORE2023,C,none,https://dblp.uni-trier.de/db/conf/inista,4602,0,N/A
International Symposium on Intelligent and Interactive Multimedia: Systems and Services,KES IIMSS,CORE2020,C,none,https://dblp.uni-trier.de/db/conf/iimss,4603,0,N/A
"International Symposium on Intelligent Multimedia, Video and Speech Processing",ISIMP,CORE2014,C,none,none,1006,0,N/A
International Symposium on Intelligent Systems and Informatics,SISY,CORE2023,National: serbia,none,https://dblp.uni-trier.de/db/conf/sisy,4602,0,N/A
International Symposium on Latin American Theoretical Informatics,LATIN,CORE2023,B,none,https://dblp.uni-trier.de/db/conf/latin,4613,2,4.0
"International Symposium on Leveraging Applications of Formal Methods, Verification and Validation",ISoLA,CORE2023,C,none,https://dblp.uni-trier.de/db/conf/isola,4612,0,N/A
International Symposium on Logic-based Program Synthesis and Transformation,LOPSTR,CORE2023,C,none,https://dblp.uni-trier.de/db/conf/lopstr,4613,0,N/A
International Symposium on Mathematical Foundations of Computer Science,MFCS,CORE2023,A,none,https://dblp.uni-trier.de/db/conf/mfcs,4613,1,5.0
International Symposium on Mathematical Morphology,ISMM,CORE2018,B,none,none,0801,0,N/A
International Symposium on Memory Management,ISMM,CORE2023,C,none,https://dblp.org/db/conf/iwmm,4606,0,N/A
International Symposium on Microarchitecture,MICRO,CORE2023,TBR,See note,https://dblp.uni-trier.de/db/conf/micro/index.html,CSE,4,5.0
"International Symposium on Modelling and Optimization in Mobile, Ad Hoc, and Wireless Networks",WiOpt,CORE2023,B,none,https://dblp.uni-trier.de/db/conf/wiopt,4606,0,N/A
"International Symposium on Networks, Computers and Communications",ISNCC,CORE2023,C,none,https://dblp.uni-trier.de/db/conf/isncc,4606,2,5.0
International Symposium on Neural Networks,ISNN,CORE2023,C,none,https://dblp.uni-trier.de/db/conf/isnn,4611,1,4.0
"International Symposium on New Ideas, New Paradigms, and Reflections on Programming and Software",Onward,CORE2023,C,none,https://dblp.org/db/conf/onward,4612,0,N/A
International Symposium on Next Generation Data Base Systems and Applications,NGDB,CORE2018,C,none,none,0804,0,N/A
International Symposium on Object Technologies for Advanced Software,ISOTAS,CORE2018,C,none,none,0803,0,N/A
International Symposium on Open Collaboration (was International Symposiums on Wikis),OPENSYM,CORE2023,C,none,https://dblp.uni-trier.de/db/conf/wikis,4612,0,N/A
International Symposium on Parallel and Distributed Computing,ISPDC,CORE2023,C,none,https://dblp.uni-trier.de/db/conf/ispdc,4606,0,N/A
"International Symposium on Parallel Architectures, Algorithms and Networks",I-SPAN,CORE2020,B,none,https://dblp.uni-trier.de/db/conf/ispan,4606,0,N/A
International Symposium on Parameterized and Exact Computation (was IWPEC pre 2004),IPEC,CORE2023,B,none,https://dblp.uni-trier.de/db/conf/iwpec,4613,0,N/A
INTERNATIONAL SYMPOSIUM ON PERVASIVE DISPLAYS,PerDis,CORE2021,B,none,https://dblp.org/db/conf/perdis,4608,0,N/A
International Symposium on Physical Design,PHYSDES,CORE2018,C,none,none,,0,N/A
International Symposium on Plasticity and Its Current Applications,,ERA2010,A,none,none,0910,0,N/A
International Symposium on Robotics,ISR,CORE2018,A,none,https://dblp.uni-trier.de/db/conf/isr,0801,0,N/A
International Symposium on Robotics Research,ISRR,CORE2023,C,See note,https://dblp.uni-trier.de/db/conf/isrr,4602,0,N/A
International Symposium on Search Based Software Engineering,SSBSE,CORE2023,B,none,https://dblp.org/db/conf/ssbse,4612,0,N/A
International Symposium on Software Engineering for Adaptive and Self-Managing Systems,SEAMS,CORE2023,A,none,https://dblp.org/db/conf/seams,4612,2,2.0
"International Symposium on Software Engineering: Theories, Tools, and Applications",SETTA,CORE2023,National:China,none,https://dblp.uni-trier.de/db/conf/setta,4612,0,N/A
International Symposium on Software Reliability Engineering,ISSRE,CORE2023,A,none,https://dblp.uni-trier.de/db/conf/issre,4612,1,5.0
International Symposium on Software Testing and Analysis,ISSTA,CORE2023,A,none,https://dblp.uni-trier.de/db/conf/issta,4612,0,N/A
International Symposium on Spatial and Temporal Databases,SSTD,CORE2023,B,none,https://dblp.uni-trier.de/db/conf/ssd,4601,0,N/A
International Symposium on Spatial Data Handling,SDH,CORE2023,C,none,none,4601,0,N/A
International Symposium on Spatial Data Infrastructures,ISSDI,CORE2018,C,none,none,0909,0,N/A
International Symposium on Spatial Data Quality,ISSDQ,CORE2023,C,none,none,4601,0,N/A
International Symposium on String Processing and Information Retrieval,SPIRE,CORE2023,C,See note,https://dblp.uni-trier.de/db/conf/spire,4605,1,5.0
International Symposium on Structural Engineering,,ERA2010,B,none,none,0905,0,N/A
International Symposium on Symbolic and Algebraic Computation,ISSAC,CORE2023,A,none,https://dblp.uni-trier.de/db/conf/issac,4613,0,N/A
International Symposium on Symbolic and Numeric Algorithms for Scientific Computing,SYNASC,CORE2023,National: romania,none,https://dblp.uni-trier.de/db/conf/synasc,4613,1,3.0
International Symposium on Technology and Society,ISTAS,CORE2023,C,none,none,46,0,N/A
International Symposium on Temporal Representation and Reasoning,TIME,CORE2023,C,none,https://dblp.uni-trier.de/db/conf/time,4602,0,N/A
International Symposium on the Mathematical Theory of Networks and Systems,MTNS,CORE2023,C,none,none,4606,0,N/A
International Symposium on Theoretical Aspects of Computer Science,STACS,CORE2023,A,none,https://dblp.uni-trier.de/db/conf/stacs,4613,2,4.0
International Symposium on Theoretical Aspects of Software Engineering,TASE,CORE2023,National: China,none,https://dblp.uni-trier.de/db/conf/tase,4612,0,N/A
International Symposium on Ubiquitous Virtual Reality,ISUVR,CORE2023,National: S. Korea,none,none,4607,0,N/A
International Symposium on Vehicle System Dynamics,,ERA2010,A,none,none,0913,0,N/A
International Symposium on Visual Computing,ISVC,CORE2023,National: USA,none,https://dblp.uni-trier.de/db/conf/isvc,4607,0,N/A
International Symposium on Voronoi diagrams in Science and Engineering,ISVD,CORE2018,C,none,none,0802,0,N/A
International Symposium on Wireless Personal Multimedia Communications,WPMC,ERA2010,C,none,none,1005,0,N/A
International Telecommunication Networks and Applications Conference (was Australian Telecommunication Networks and Applications Conference),ITNAC,CORE2023,Australasian C,none,https://dblp.uni-trier.de/db/conf/itnac,4606,6,4.8
International Teletraffic Congress,ITC,CORE2023,Unranked,none,https://dblp.uni-trier.de/db/conf/teletraffic,4606,0,N/A
International Towing Tank Conference,,ERA2010,A,none,none,0911,0,N/A
International Tribology Conference in Australia,,ERA2010,A,none,none,0910,0,N/A
International Urban Design Conference,IUDC,ERA2010,C,none,none,1205,0,N/A
International Visualization in Transportation Symposium,TRB,CORE2023,National: USA,none,none,4608,0,N/A
International Web Conference,IWC,CORE2018,C,none,none,0806,0,N/A
International Wireless Internet Conference,WiCon,ERA2010,C,none,none,1005,0,N/A
International Wordnet Conference (Global Wordnet Conference),GWC,CORE2023,C,none,https://dblp.uni-trier.de/db/conf/wordnet,4605,0,N/A
International Work-Conference on Artificial and Natural Neural Networks,IWANN,CORE2023,National: Spain,none,https://dblp.uni-trier.de/db/conf/iwann,4611,0,N/A
International Work-conference on the Interplay between Natural and Artificial Computation,IWINAC,CORE2023,National,none,https://dblp.uni-trier.de/db/conf/iwinac,4602,0,N/A
International Workshop in Software Measurement (Joined with Mensura from 2007),IWSM,CORE2014,C,none,none,0804,0,N/A
International Workshop of the Initiative for the Evaluation of XML Retrieval,INEX,CORE2018,C,none,none,0803,0,N/A
International Workshop on Abstract State Machines,ASM(W),CORE2018,C,none,none,0802,0,N/A
International Workshop on Advanced Architectures and Algorithms for Internet Delivery and Applications,AAA-IDEA,CORE2018,C,none,none,0806,0,N/A
International Workshop on Agents and Data Mining Interaction,ADMI,CORE2020,B,none,https://dblp.uni-trier.de/db/conf/admi,4602,0,N/A
International Workshop on Algebraic and Combinatorial Coding Theory,ACCT,CORE2023,National,none,none,4613,0,N/A
"International Workshop on Aliasing, Confinement and Ownership",IWACO,CORE2018,C,none,none,0803,0,N/A
International Workshop on Ant Colony,ANTS,CORE2018,B,none,none,0801,0,N/A
International Workshop on Approximation Algorithms for Combinatorial Optimization Problems and International Conference on Randomization and Computation,APPROX/RANDOM,CORE2023,A,none,https://dblp.uni-trier.de/db/conf/approx,4613,0,N/A
International Workshop on Artificial Intelligence and Statistics,WAIS,CORE2018,B,none,none,,0,N/A
International Workshop on Boolean Functions: Cryptography and Applications,BFCA,CORE2018,C,none,none,0804,0,N/A
International Workshop on Business Process Design,BPD,CORE2018,C,none,none,0806,0,N/A
International Workshop on Business Process Intelligence,BPI,CORE2018,C,none,none,0806,0,N/A
"International Workshop on Business Process Modelling, Development, and Support",BPMDS,CORE2018,C,none,none,0806,3,3.5
International Workshop on C# and .NET Technologies,C#,CORE2018,C,none,none,0803,0,N/A
International Workshop on Coding and Cryptography,WCC,CORE2020,B,none,https://dblp.uni-trier.de/db/conf/wcc,4604,0,N/A
International Workshop on Combinations of Intelligent Methods and Applications,CIMA,CORE2023,C,none,none,4602,0,N/A
International Workshop on Combinatorial Algorithm,IWOCA,CORE2023,C,See note,https://dblp.uni-trier.de/db/conf/iwoca,4613,1,4.0
International Workshop on Combinatorial Image Analysis: Theory and Applications,IWCIA,CORE2023,C,none,https://dblp.uni-trier.de/db/conf/iwcia,4603,0,N/A
International Workshop on Comparative Evaluation in Requirements Engineering,CERE,CORE2018,C,none,none,0803,0,N/A
International Workshop on Computer-Aided Software Eng,IWCASE,CORE2018,B,none,none,0803,0,N/A
"International Workshop on Coordination, Organizations, Institutions, Norms and Ethics for Governance of Multi-Agent Systems (Ethics added 2020)",COINE,CORE2023,C,none,https://dblp.uni-trier.de/db/conf/coin-ws/,4602,2,4.0
International Workshop on Critical Information Infrastructures Security,CRITIS,CORE2023,C,none,https://dblp.uni-trier.de/db/conf/critis,4604,0,N/A
International Workshop on Data Management on New Hardware,DaMoN,CORE2023,C,none,https://dblp.org/db/conf/damon,4605,0,N/A
International Workshop on Data Warehousing and OLAP,DOLAP,CORE2023,C,See note,https://dblp.uni-trier.de/db/conf/dolap,4605,0,N/A
International Workshop on Developments in Computational Models,DCM,CORE2020,C,none,https://dblp.uni-trier.de/db/conf/dcm,4613,0,N/A
International Workshop on Digital Watermarking,IWDW,CORE2023,C,none,https://dblp.uni-trier.de/db/conf/iwdw,4604,0,N/A
International Workshop on Distributed Object Management,IWDOM,CORE2018,C,none,none,0803,0,N/A
International Workshop on Document Analysis Systems,DAS,CORE2023,B,none,https://dblp.uni-trier.de/db/conf/das,4605,0,N/A
International Workshop on Domain Driven Data Mining,DDDM,CORE2018,C,none,none,0804,0,N/A
International Workshop on Economics-Driven Software Engineering Research,EDSER,CORE2018,C,none,none,0803,0,N/A
International Workshop on Efficient Algorithms,WEA,CORE2018,B,none,none,0802,0,N/A
International Workshop on Enterprise and Organizational Modelling and Simulation,EOMAS,CORE2023,C,none,none,4612,0,N/A
International Workshop on Entertainment Computing,WEC,CORE2018,C,none,none,0806,0,N/A
International Workshop on Evolution and Change in Data Management,ECDM,CORE2018,C,none,none,0804,0,N/A
International Workshop on Fast Software Encryption,FSE,CORE2023,Journal Published,none,none,4604,0,N/A
International Workshop on Formal Methods for interactive Systems,FMIS,CORE2023,C,none,none,4612,0,N/A
International Workshop on Formal Methods for Parallel Programming: Theory and Applications,FMPPTA,CORE2018,C,none,none,0802,0,N/A
International Workshop on Foundations for Secure/Survivable Systems and Networks,FSSSSN,ERA2010,C,none,none,1005,0,N/A
International Workshop on Foundations of Models and Languages for Data and Objects,FMLDO,CORE2018,C,none,none,0804,0,N/A
International Workshop on Foundations of Object-Oriented Languages,FOOL,CORE2018,C,none,none,0803,0,N/A
International Workshop on Functional and Constraint Logic Programming,WFLP,CORE2021,C,none,https://dblp.uni-trier.de/db/conf/wflp,4612,0,N/A
International Workshop on Genetic and Evolutionary Fuzzy Systems,GEFS,CORE2018,C,none,none,0801,0,N/A
International Workshop on Global Optimization,GO,CORE2018,C,none,none,0802,0,N/A
International Workshop on Graph-Theoretic Concepts in Computer Science,WG,CORE2023,B,See note,https://dblp.uni-trier.de/db/conf/wg,4613,0,N/A
International Workshop on Group-Oriented Cryptographic Protocols,GOCP,CORE2018,C,none,none,0804,0,N/A
International workshop on High-Level Parallel Programming and Applications,HLPP,CORE2023,C,none,none,4606,0,N/A
International Workshop on High-Level Parallel Programming Models and Supportive Environments,HIPS,CORE2023,C,none,none,4606,0,N/A
International Workshop on Hot topics in Peer-to-Peer Systems,HotP2P,CORE2018,C,none,none,0805,0,N/A
"International Workshop on Human Aspects in Ambient Intelligence: Agent Technology, Human-Oriented Knowledge and Applications",HAI,CORE2018,C,none,none,0801,0,N/A
International Workshop on Image Analysis and Information Fusion,IAIF,CORE2018,C,none,none,0801,0,N/A
"International Workshop on Incorporating COTS Software into Software Systems, Tools and Techniques",IWICSS,CORE2018,C,none,none,0804,0,N/A
International Workshop on Information Security Applications,WISA,CORE2023,National: korea,none,https://dblp.uni-trier.de/db/conf/wisa,4604,0,N/A
International Workshop on Intelligent Agents,IWIA,CORE2018,C,none,none,0801,0,N/A
International Workshop on Interactive Entertainment,IDET,CORE2018,C,none,none,0806,0,N/A
International Workshop on Issues in the Theory of Security,WITS,CORE2018,C,none,none,0803,0,N/A
International Workshop on Knowledge Discovery from Data Streams,IWKDDS,CORE2018,C,none,none,0801,0,N/A
International Workshop on Logic and Complexity in Computer Science,LCCS,CORE2018,C,none,none,0802,0,N/A
International Workshop on Logic Programming and Multi-Agents,LPMA,CORE2018,B,none,none,,0,N/A
International Workshop on Metamodelling - Utilization in Software Engineering,MUSE,CORE2018,C,none,none,0803,0,N/A
International Workshop on Middleware for Grid Computing,MGC,CORE2018,C,none,none,0805,0,N/A
International Workshop on Mobile Commerce and Services,WMCS,CORE2018,C,none,none,0806,0,N/A
International Workshop on Modelling and Visualization of XML and Semantic Web Data,MOVIX,CORE2018,C,none,none,0804,0,N/A
International Workshop on Modelling in Software Engineering,MISE,CORE2023,C,none,none,4612,0,N/A
"International Workshop on Modelling, Simulation, Verification and Validation of Enterprise Information Systems",MSVVEIS,CORE2018,C,none,none,0806,0,N/A
International Workshop on MultiAgent Based Simulation,MABS,CORE2023,C,none,https://dblp.uni-trier.de/db/conf/mabs,4602,0,N/A
"International Workshop on Multimedia Data Storage, Retrieval, Integration and Applications",MDSRIA,CORE2018,C,none,none,0806,0,N/A
International Workshop on Multimedia Signal Processing,MMSP,CORE2023,C,See note,https://dblp.uni-trier.de/db/conf/mmsp,4603,1,5.0
"International Workshop on Nonmonotonic Reasoning, Action and Change",NRAC,CORE2018,C,none,none,0801,0,N/A
International Workshop on Paraphrasing,IWP,CORE2018,B,none,none,0801,0,N/A
International Workshop on Parsing Technologies,IWPT,CORE2018,B,none,none,0803,0,N/A
International Workshop on Pattern Recognition in Information Systems,PRIS,CORE2018,C,none,none,0806,0,N/A
International Workshop on Post-Quantum Cryptography,PQCrypto,CORE2023,C,none,https://dblp.uni-trier.de/db/conf/pqcrypto,4604,0,N/A
International Workshop on Precipitation in Urban Areas,,ERA2010,A,none,none,0905,0,N/A
International Workshop on Principles of Diagnosis,DX,CORE2023,C,none,none,4612,0,N/A
International Workshop on Quality of Information Systems,QOIS,CORE2018,C,none,none,0806,0,N/A
International Workshop on Randomization and Computation,RANDOM,CORE2021,A,none,https://dblp.uni-trier.de/db/conf/random,4613,0,N/A
International Workshop on Realising Evidence-based Software Engineering,REBSE,CORE2018,C,none,none,0803,0,N/A
International Workshop on Requirements Engineering Visualization,REV,CORE2018,B,none,none,0802,0,N/A
International Workshop on Requirements Engineering: Foundation for Software Quality,REFSQ,CORE2023,B,none,https://dblp.uni-trier.de/db/conf/refsq,4612,5,4.0
International Workshop on Research Issues in Data Engineering,RIDE,CORE2018,B,none,none,0804,0,N/A
International Workshop on Satellite and Space Communications,IWSSC,ERA2010,C,none,none,1005,0,N/A
International Workshop on Schema Languages for XML,X-Schemas,CORE2018,C,none,none,0803,0,N/A
International Workshop on Security,IWSEC,CORE2023,National: Japan,none,https://dblp.uni-trier.de/db/conf/iwsec,4604,0,N/A
International Workshop on Security in Information Systems,WOSIS,CORE2018,C,none,none,0803,0,N/A
International Workshop on Security Protocols,IWSP,CORE2018,C,none,none,0803,0,N/A
International Workshop on Soft Computing Applications,SOFA,CORE2023,National: Romania,none,none,4601,3,5.0
International Workshop on Software and Compilers for Embedded Systems,SCOPES,CORE2023,C,none,https://dblp.uni-trier.de/db/conf/scopes,4606,0,N/A
International Workshop on Software Engineering for High Performance Computing Applications,SE-HPC,CORE2018,C,none,none,0805,0,N/A
International Workshop on Software Process Simulation and Modelling (now ICSP),PROSim,CORE2014,B,none,none,0803,0,N/A
International Workshop on Software Product Management,IWSPM,CORE2018,C,none,none,0803,0,N/A
International Workshop on Software Quality,WoSQ,CORE2018,C,none,none,0804,0,N/A
International Workshop on Software Technology for Augmented Reality Systems,IWSTAR,CORE2018,C,none,none,0806,0,N/A
International Workshop on Temporal Databases,TDB,CORE2018,C,none,none,0804,0,N/A
International Workshop on the Algorithmic Foundations of Robotics,WAFR,CORE2023,C,none,https://dblp.uni-trier.de/db/conf/wafr,4602,0,N/A
International Workshop on the Sate of the Art in Cryptology and New Challenges Ahead,Quo Vadis Cryptology,CORE2018,C,none,none,0804,0,N/A
International Workshop on the Web and Databases,WebDB,CORE2020,National: USA,none,https://dblp.uni-trier.de/db/conf/webdb,4605,0,N/A
International Workshop on Visualization for Cyber Security,VizSec,CORE2023,C,none,https://dblp.uni-trier.de/db/conf/vizsec,4608,0,N/A
International Workshop on Web and Wireless Geographical Information Systems,W2GIS,CORE2023,C,none,https://dblp.uni-trier.de/db/conf/w2gis,4601,0,N/A
International Workshop on Web Content Caching and Distribution,WCW,CORE2018,B,none,none,0806,0,N/A
International Workshop on Web Information Systems Modelling,WISM,CORE2018,C,none,none,0806,0,N/A
International Workshop on Wireless and Mobile Networks,WiMoNe,ERA2010,C,none,none,1005,0,N/A
International Workshop Programming Multi-Agent Systems (merged into EMAS in 2013),PROMAS,ERA2010,B,none,none,0804,0,N/A
International Workshops on Enabling Technologies: Infrastructures for Collaborative Enterprises,WETICE,CORE2023,C,none,https://dblp.uni-trier.de/db/conf/wetice,4606,1,5.0
International Workshops on First-Order Theorem Proving,FTP,CORE2018,B,none,none,0802,0,N/A
International World Wide Web Conference,WWW,CORE2023,A*,none,https://dblp.uni-trier.de/db/conf/www,4606,2,4.5
International XML Database Symposium,Xsym,CORE2018,C,none,none,0804,0,N/A
Internationale Tagung Wirtschaftsinformatik,DITW,CORE2018,C,none,none,0806,0,N/A
Internet Measurement Conference,IMC,CORE2023,A,none,https://dblp.uni-trier.de/db/conf/imc,4606,0,N/A
Internet Research,AOIR,CORE2018,C,none,none,0806,0,N/A
Internet Society Conference,INET,CORE2018,C,none,none,0806,0,N/A
Interoperating Geographic Information Systems,INTEROP,CORE2018,C,none,none,0806,0,N/A
Interspeech (combined EuroSpeech and ICSLP in 2000),Interspeech,CORE2023,A,none,https://dblp.uni-trier.de/db/conf/interspeech,4602,0,N/A
INTUITION International Conference,INTUITION,CORE2018,C,none,none,0801,0,N/A
ISC High Performance (was International Supercomputing Conference),ISC,CORE2023,C,none,https://dblp.uni-trier.de/db/conf/supercomputer,4606,0,N/A
ISCA International Conference on Computer Applications in Industry and Engineering,CAINE,CORE2023,C,none,none,4601,0,N/A
ISCA Tutorial and Research Workshop Automatic Speech Recognition,ASR,CORE2018,C,none,none,0801,0,N/A
Israel Symposium on Theory of Computing and Systems,ISTCS,CORE2008,A,none,none,,0,N/A
Italian Conference on Theoretical Computer Science,ICTCS,ERA2010,C,none,none,0802,0,N/A
Italian Symposium on Advanced Database Systems,SEBD,ERA2010,C,none,none,0804,1,4.0
IUTAM Symposia series,,ERA2010,A,none,none,0913,0,N/A
IWA World Water Congress,,ERA2010,A,none,none,0905,0,N/A
Japan Conference on Computational Geometry and Graphs,JCCGG,ERA2010,C,none,none,0802,0,N/A
Japan Conference on Discrete and Computational Geometry,JCDCG,ERA2010,C,none,none,0802,0,N/A
Japan-China Joint Workshop on Frontier of Computer Science and Technology,FCST,ERA2010,C,none,none,08,0,N/A
Japan-Korea Joint Workshop on Algorithms and Computations,WAAC,ERA2010,C,none,none,0802,0,N/A
Japanese-Hungarian Symposium on Discrete Mathematics and Its Applications,JH,ERA2010,C,none,none,0802,0,N/A
Joint AUPEC & EECON,PEC&CON,CORE2018,C,none,none,,0,N/A
Joint Australia and New Zealand Biennial Conference on Digital Image and Vision Computing,DIVC,CORE2018,Australasian,none,none,0801,0,N/A
Joint Conference of the International Workshop on Software Measurement and the International Conference on Software Process and Product Measurement (IWSM and Mensura combined from 2007),IWSM Mensura,CORE2023,C,none,https://dblp.uni-trier.de/db/conf/iwsm,4612,0,N/A
"Joint Conference on Computer Vision, Imaging and Computer Graphics Theory and Applications (GRAPP and VISAPP combined from 2008)",VISIGRAPP,CORE2023,Multiconference,none,https://dblp.uni-trier.de/db/conf/visigrapp,4603,0,N/A
Joint Conference on Declarative Programming APPIA-GULP-PRODE,APPIA/GULP/PRODE,CORE2018,C,none,none,,0,N/A
